### ISSUE TITLE
[Bug]: Android app delays API requests for several minutes on cellular with Tailscale, but responds immediately when Wi-Fi is enabled

### ISSUE THREAD

**Issue by AndyPro720** [CodeWithCJ/SparkyFitness#1767]
### What happened?

The SparkyFitness Android app frequently remains stuck loading when the phone is using mobile data with Tailscale connected.

The self-hosted SparkyFitness instance is reachable through:

Android phone
→ cellular or Wi-Fi
→ Tailscale
→ nginx reverse proxy
→ SparkyFitness frontend
→ SparkyFitness API

The configured URL is:

https://fitness.server.xx.org

On Wi-Fi, the Android app works normally.

On cellular with Tailscale connected, the app may remain stuck for approximately one to five minutes before requests are sent. The problem affects both:

Initial server URL validation
Subsequent uncached data requests, such as opening data from an earlier date

Even after the app eventually connects, navigating to data that has not already been fetched may trigger another long loading period.

Closing and reopening the app on cellular reproduces the delayed-loading behaviour.

Turning on Wi-Fi while a request is stuck causes the request to start immediately. The traffic still reaches the server using the phone's Tailscale IP, so it appears that the Wi-Fi network-change event causes the app to resume or recreate its networking state.

Server-side packet capture shows that during the loading period, the app does not open a new TCP connection to the server. When Wi-Fi is enabled, the phone immediately opens several new HTTPS connections and the API requests complete normally.

This suggests that the issue occurs before the request reaches nginx, possibly in the Android app's network-state detection, React Native NetInfo handling, VPN handling, or OkHttp connection lifecycle.

The web interface and other Android applications can reach the same endpoint over cellular and Tailscale without this delay.

### Steps to reproduce

Steps to reproduce
Run a self-hosted SparkyFitness instance behind nginx with a valid HTTPS certificate.
Make the instance available through Tailscale.
Configure the SparkyFitness Android app with the HTTPS server URL.
Connect the Android phone to mobile data.
Ensure Tailscale is connected.
Turn Wi-Fi off.
Force-stop and reopen the SparkyFitness Android app.
Open the dashboard or navigate to data that has not already been cached, such as a previous date.
Observe that the app remains stuck loading for approximately one to five minutes.
While the app is still loading, turn Wi-Fi on.
Observe that the pending request starts and completes almost immediately.

The issue can also occur during the initial server URL validation step

### Expected behavior

The Android app should issue API requests immediately when mobile data and the Tailscale VPN provide a working route to the configured server.

The app should not require Wi-Fi or a Wi-Fi network-change event before making requests.

Cellular, VPN and Wi-Fi network transitions should recreate or update the app's network state without delaying requests for several minutes.

### How are you running SparkyFitness?

Docker Compose

### SparkyFitness version

0.17.1

### Which area is affected?

Mobile app (Android)

### Docker Compose & Environment Configuration

```yaml
Relevant nginx configuration:

server {
    listen 443 ssl;
    listen [::]:443 ssl;
    http2 on;

    server_name fitness.server.xx.org;

    ssl_certificate /etc/letsencrypt/live/server.angaj.org/fullchain.pem;
    ssl_certificate_key /etc/letsencrypt/live/server.angaj.org/privkey.pem;

    client_max_body_size 100M;

    location / {
        proxy_pass http://sparkyfitness-sparkyfitness-frontend-1:80;

        proxy_set_header Host $host;
        proxy_set_header X-Real-IP $remote_addr;
        proxy_set_header X-Forwarded-For $proxy_add_x_forwarded_for;
        proxy_set_header X-Forwarded-Proto $scheme;
        proxy_set_header X-Forwarded-Host $host;
        proxy_set_header X-Forwarded-Port $server_port;

        proxy_connect_timeout 10s;
        proxy_send_timeout 300s;
        proxy_read_timeout 600s;

        proxy_set_header Upgrade $http_upgrade;
        proxy_set_header Connection $http_connection;
    }
}

The following endpoints return successfully and quickly through both LAN and Tailscale:

GET /api/auth/settings
GET /api/dashboard/stats

/api/auth/settings returns HTTP 200 in approximately 45 ms through both routes.

The protected dashboard endpoint correctly returns HTTP 401 when called without authentication.

The TLS certificate is valid and verified successfully by curl.
```

### Runtime Logs (Server, Web, or Mobile)

```shell
During normal operation on Wi-Fi, nginx receives requests from the Android app using OkHttp:

GET /api/identity/user HTTP/1.1 200
User-Agent: okhttp/4.12.0

GET /api/daily-summary?... HTTP/1.1 200
User-Agent: okhttp/4.12.0

GET /api/user-preferences HTTP/1.1 200
User-Agent: okhttp/4.12.0

POST /api/health-data HTTP/1.1 200
User-Agent: okhttp/4.12.0

During the cellular-only loading period, no corresponding request appears in nginx access logs.

A server-side tcpdump was run with:

sudo tcpdump -ni tailscale0 \
  'host 100.68.191.7 and tcp port 443' \
  -tttt

At approximately 13:53:22, the phone cleanly closed four existing HTTPS connections:

100.68.191.7.49472 > 100.64.0.10.443: Flags [F.]
100.68.191.7.59122 > 100.64.0.10.443: Flags [F.]
100.68.191.7.59138 > 100.64.0.10.443: Flags [F.]
100.68.191.7.59132 > 100.64.0.10.443: Flags [F.]

There were then no connection attempts during the stuck loading period.

At approximately 13:55:01, immediately after Wi-Fi was enabled, the phone opened several new HTTPS connections:

100.68.191.7.46870 > 100.64.0.10.443: Flags [S]
100.68.191.7.46894 > 100.64.0.10.443: Flags [S]
100.68.191.7.46908 > 100.64.0.10.443: Flags [S]
100.68.191.7.46884 > 100.64.0.10.443: Flags [S]

The server returned SYN-ACK immediately and TLS/application traffic followed normally.

This indicates that:

The server and Tailscale route were reachable.
nginx was not delaying the request.
No TCP connection was being attempted during the loading period.
Enabling Wi-Fi caused the app to immediately initiate new connections over the same Tailscale source and destination addresses.
```

### Anything else?

Phone: Samsung Galaxy s24 ultra 
Android device 
Android: Android 16 
App HTTP client: OkHttp 4.12.0 
VPN: Tailscale for Android 
Server: Docker Compose on Linux 
Reverse proxy: nginx 
TLS: Let's Encrypt

**Comment by CodeWithCJ** [comment]
Are you able to access via browser?

**Comment by AndyPro720** [comment]
@CodeWithCJ Yes browser (and PWA) access is completely fine.

**Comment by apedley** [comment]
Was this a problem that started with this weeks update?

**Comment by apedley** [comment]
Thanks for the detailed report. Looks like this might be related to an Android 16  interaction plus a missing timeout bug on our side. I'm going to make a PR for both fixes. If this stated with app version 1.5.0 then it should fix your issues.

**Comment by AndyPro720** [comment]
No, it's been since day one. I just thought it was an issue on my end and didn't want to hassle you folks! Thanks for your prompt follow-ups.

**Comment by apedley** [comment]
> No, it's been since day one. I just thought it was an issue on my end and didn't want to hassle you folks! Thanks for your prompt follow-ups.

Thanks, that rules out the permissions. The timeout fix will still apply but that's more of a "recover fast"  thing and doesnt fix the issue..

To narrow it down, after the next update is out check and see if it happens mid session or only when the app loads. App logs from a stuck period would help too.

**Comment by AndyPro720** [comment]
Okay so since this update, it has been working fine.

**Comment by CodeWithCJ** [comment]
Awesome!!!
